{
  "constraints": "C:\\Projects\\pil-agent-plugin\\pil-agent-plugin\\runs\\2026-09-05-six-capabilities\\proof-v2\\constraints.json",
  "correspondences": "C:\\Projects\\pil-agent-plugin\\pil-agent-plugin\\runs\\2026-09-05-six-capabilities\\proof-v2\\correspondences.json",
  "schema": "reconstruction-job-v1",
  "spec": "C:\\Projects\\pil-agent-plugin\\pil-agent-plugin\\runs\\2026-09-05-six-capabilities\\proof-v2\\multiview.json",
  "template": "C:\\Projects\\pil-agent-plugin\\pil-agent-plugin\\runs\\2026-09-05-six-capabilities\\proof-v2\\template.json"
}